{
  "case_id": "SECRET-001",
  "title": "支付网关密钥硬编码",
  "category": "secrets",
  "scope": "production",
  "frameworks": [
    "spring-mvc"
  ],
  "source": "synthetic",
  "license": "MIT",
  "notes": "值为语料占位符，用于验证规则命中，非真实凭据。",
  "expected": "vulnerable",
  "expected_rules": [
    "JAL-SECRET-001"
  ],
  "evidence_level": "inferred",
  "expected_locations": [
    {
      "path": "src/main/java/lab/corpus/secrets/PaymentController.java",
      "line": 19
    }
  ]
}
