{
  "case_id": "SECRET-002",
  "title": "密钥由部署配置注入",
  "category": "secrets",
  "scope": "production",
  "frameworks": [
    "spring-mvc"
  ],
  "source": "synthetic",
  "license": "MIT",
  "notes": "密钥存在于运行环境，不存在于版本历史。",
  "expected": "safe",
  "forbidden_rules": [
    "JAL-SECRET-001"
  ],
  "security_controls": [
    "@Value 注入，源码无字面值"
  ]
}
